Title,Genre,Run Time,Rating,Number of Votes,Year,Certificate,Synopsis,Actors,Image
Rugrats,"Animation, Adventure, Comedy",30 min,7.4,"37,270",(1991–2006),Certificate N/A,The cartoon misadventures of four babies and their snotty older cousin as they face the things in life they don't understand.,"Elizabeth Daily, Christine Cavanaugh, Nancy Cartwright, Kath Soucie",https://m.media-amazon.com/images/S/sash/4FyxwxECzL-U1J8.png
Sofia the First,"Animation, Adventure, Family",22 min,6.9,"3,458",(2012–2018),Certificate N/A,Sofia is a little girl with a commoner's background until her mom marries the king and suddenly she is royalty.,"Ariel Winter, LC Powell, Darcy Rose Byrnes, Travis Willingham",https://m.media-amazon.com/images/S/sash/4FyxwxECzL-U1J8.png
Hart to Hart,"Action, Adventure, Crime",60 min,6.7,"8,419",(1979–1984),Certificate N/A,The globe-trotting adventures of amateur detectives Jonathan and Jennifer Hart.,"Robert Wagner, Stefanie Powers, Lionel Stander, Lee Wilkof",https://m.media-amazon.com/images/S/sash/4FyxwxECzL-U1J8.png
Jurassic World: Camp Cretaceous,"Animation, Action, Adventure",24 min,7.5,"9,896",(2020–2022),Certificate N/A,Six teens attending an adventure camp on the opposite side of Isla Nublar must band together to survive when dinosaurs wreak havoc on the island.,"Paul-Mikél Williams, Kausar Mohammed, Raini Rodriguez, Jenna Ortega",https://m.media-amazon.com/images/S/sash/4FyxwxECzL-U1J8.png
Space: 1999,"Adventure, Drama, Sci-Fi",50 min,7.3,"9,021",(1975–1977),Certificate N/A,The crew of Moonbase Alpha must struggle to survive when a massive explosion throws the Moon from orbit into deep space.,"Martin Landau, Barbara Bain, Nick Tate, Zienia Merton",https://m.media-amazon.com/images/S/sash/4FyxwxECzL-U1J8.png
The New Batman Adventures,"Animation, Action, Adventure",30 min,8.4,"18,373",(1997–1999),Certificate N/A,"The further and darker adventures of Batman with a new Robin, a closer association with Batgirl and the previous Robin now as Nightwing.","Kevin Conroy, Tara Strong, Mathew Valencia, Efrem Zimbalist Jr.",https://m.media-amazon.com/images/S/sash/4FyxwxECzL-U1J8.png
Hagane no renkinjutsushi,"Animation, Action, Adventure",24 min,8.5,"74,860",(2003–2004),Certificate N/A,"When a failed alchemical ritual leaves brothers Edward and Alphonse Elric with severely damaged bodies, they begin searching for the one thing that can save them: the fabled philosopher's stone.","Vic Mignogna, Aaron Dismuke, Romi Park, Rie Kugimiya",https://m.media-amazon.com/images/S/sash/4FyxwxECzL-U1J8.png
The Outpost,"Action, Adventure, Drama",44 min,6.5,"8,794",(2018–2021),Certificate N/A,"Talon, the lone survivor of the Blackbloods, sets off to track her family's killers, and discovers her supernatural powers, which she must learn to harness.","Jessica Green, Jake Stormoen, Anand Desai-Barochia, Adam Johnson",https://m.media-amazon.com/images/S/sash/4FyxwxECzL-U1J8.png
Grim & Evil,"Animation, Adventure, Comedy",30 min,7.7,"25,456",(2001–2007),Certificate N/A,The ill-tempered Grim Reaper gets into a wager that forces him to become the life-long companions of two scheming youngsters after he loses.,"Greg Eagles, Richard Steven Horvitz, Grey Griffin, Vanessa Marshall",https://m.media-amazon.com/images/S/sash/4FyxwxECzL-U1J8.png
Gargoyles,"Animation, Action, Adventure",30 min,8.0,"17,844",(1994–1997),Certificate N/A,A clan of heroic night creatures pledge to protect modern New York City as they did in Scotland one thousand years earlier.,"Keith David, Salli Richardson-Whitfield, Jeff Bennett, Frank Welker",https://m.media-amazon.com/images/S/sash/4FyxwxECzL-U1J8.png
The Flintstones,"Animation, Adventure, Comedy",26 min,7.5,"39,557",(1960–1966),Certificate N/A,"The misadventures of two modern-day Stone Age families, the Flintstones and the Rubbles.","Alan Reed, Mel Blanc, Jean Vander Pyl, Bea Benaderet",https://m.media-amazon.com/images/S/sash/4FyxwxECzL-U1J8.png
V,"Action, Adventure, Sci-Fi",197 min,7.8,"16,614",(1983),Certificate N/A,"When aliens come to Earth to ask for our help, a few suspicious humans discover their horrific true intentions and prepare to resist.","Jane Badler, Michael Durrell, Faye Grant, Peter Nelson",https://m.media-amazon.com/images/S/sash/4FyxwxECzL-U1J8.png
Rise of the Teenage Mutant Ninja Turtles,"Animation, Action, Adventure",22 min,5.7,"5,892",(2018–2020),Certificate N/A,Four mutant turtle brothers go on adventures where they end up tapping into mystic ninja powers.,"Ben Schwartz, Brandon Mychal Smith, Omar Benson Miller, Josh Brener",https://m.media-amazon.com/images/S/sash/4FyxwxECzL-U1J8.png
Scarecrow and Mrs. King,"Adventure, Comedy, Romance",60 min,7.0,"3,587",(1983–1987),Certificate N/A,"The adventures of a housewife and a spy, with whom she fell in love.","Kate Jackson, Bruce Boxleitner, Beverly Garland, Mel Stewart",https://m.media-amazon.com/images/S/sash/4FyxwxECzL-U1J8.png
Limitless,"Documentary, Adventure",50 min,8.0,"3,653",(2022),Certificate N/A,"A different way we can live better for longer: regenerating damage, maximizing strength, building resilience, shocking the body, supercharging memory and confronting mortality.","Chris Hemsworth, Peter Attia, Elsa Pataky, Luke Zocchi",https://m.media-amazon.com/images/S/sash/4FyxwxECzL-U1J8.png
Ironheart,"Action, Adventure, Drama",Run Time N/A,Rating N/A,Votes N/A,(2023– ),Certificate N/A,Genius teenage inventor Riri Williams creates the most advanced suit of armor since Iron Man.,"Dominique Thorne, Alden Ehrenreich, Zoe Terakes, Manny Montana",https://m.media-amazon.com/images/S/sash/4FyxwxECzL-U1J8.png
The Dark Crystal: Age of Resistance,"Animation, Adventure, Family",60 min,8.4,"26,286",(2019),Certificate N/A,"Return to the world of Thra, where three Gelfling discover the horrifying secret behind the Skeksis' power, and set out to ignite the fires of rebellion and save their world.","Neil Sterenberg, Beccy Henderson, Nathalie Emmanuel, Taron Egerton",https://m.media-amazon.com/images/S/sash/4FyxwxECzL-U1J8.png
Krypton,"Action, Adventure, Drama",45 min,6.8,"17,334",(2018–2019),Certificate N/A,The untold story of Superman's grandfather as he fights for justice on his home planet.,"Cameron Cuffe, Georgina Campbell, Shaun Sipos, Ann Ogbomo",https://m.media-amazon.com/images/S/sash/4FyxwxECzL-U1J8.png
Emerald City,"Adventure, Drama, Fantasy",60 min,7.1,"13,182",(2016–2017),Certificate N/A,A modern reimagining of the stories that led to 'The Wizard of Oz'.,"Adria Arjona, Oliver Jackson-Cohen, Ana Ularu, Gerran Howell",https://m.media-amazon.com/images/S/sash/4FyxwxECzL-U1J8.png
Big City Greens,"Animation, Adventure, Comedy",22 min,7.5,"2,888",(2018– ),Certificate N/A,"The adventurous life of Cricket Green, a country boy who moves with his family from their rural farm to a modern metropolis.","Chris Houghton, Bob Joles, Marieve Herington, Artemis Pebdani",https://m.media-amazon.com/images/S/sash/4FyxwxECzL-U1J8.png
Black Lagoon,"Animation, Action, Adventure",25 min,7.9,"16,846",(2006),Certificate N/A,"A Japanese businessman, captured by modern-day pirates, is written off and left for dead by his company. Tired of the corporate life, he opts to stick with the mercenaries that kidnapped him, becoming part of their gang.","Megumi Toyoguchi, Daisuke Namikawa, Brad Swaile, Maryke Hendrikse",https://m.media-amazon.com/images/S/sash/4FyxwxECzL-U1J8.png
The Bionic Woman,"Action, Adventure, Drama",60 min,6.7,"7,800",(1976–1978),Certificate N/A,"After fully recovering from her nearly fatal bout of bionic rejection, Jaime Sommers, the first female cyborg, is assigned to spy missions of her own.","Lindsay Wagner, Richard Anderson, Martin E. Brooks, Ford Rainey",https://m.media-amazon.com/images/S/sash/4FyxwxECzL-U1J8.png
The Baby-Sitters Club,"Adventure, Comedy, Drama",Run Time N/A,7.5,"4,551",(2020–2021),Certificate N/A,Based on the book series of the same name focusing on a group of young girls who start their own babysitting service.,"Sophie Grace, Momona Tamada, Shay Rudolph, Malia Baker",https://m.media-amazon.com/images/S/sash/4FyxwxECzL-U1J8.png
AJ and the Queen,"Adventure, Comedy, Drama",52 min,7.6,"8,960",(2020),Certificate N/A,"Ruby Red, a down-on-her-luck drag queen traveling across America, develops an unlikely sidekick named AJ.","RuPaul, Izzy G., Michael-Leon Wooley, Josh Segarra",https://m.media-amazon.com/images/S/sash/4FyxwxECzL-U1J8.png
Buck Rogers in the 25th Century,"Action, Adventure, Sci-Fi",60 min,6.9,"9,991",(1979–1981),Certificate N/A,A 20th-century astronaut emerges out of 500 years of suspended animation into a future time to become Earth's greatest hero.,"Gil Gerard, Erin Gray, Felix Silla, Mel Blanc",https://m.media-amazon.com/images/S/sash/4FyxwxECzL-U1J8.png
Sonic Prime,"Animation, Action, Adventure",22 min,7.3,"2,064",(2022– ),Certificate N/A,Sonic in a high-octane adventure where the fate of a strange new multiverse rests in his gloved hands.,"Deven Christian Mack, Ashleigh Ball, Vincent Tong, Kazumi Evans",https://m.media-amazon.com/images/S/sash/4FyxwxECzL-U1J8.png
The 10th Kingdom,"Adventure, Comedy, Family",417 min,8.3,"19,697",(2000),Certificate N/A,"A father and daughter are caught in a parallel universe where the great Queens Snow White, Cinderella and Riding Hood III have had their kingdoms fragmented by warring trolls, giants and goblins.","Kimberly Williams-Paisley, Scott Cohen, Dianne Wiest, Daniel Lapaine",https://m.media-amazon.com/images/S/sash/4FyxwxECzL-U1J8.png
Ben 10: Alien Force,"Animation, Action, Adventure",22 min,7.4,"12,885",(2008–2010),Certificate N/A,"Fifteen-year-old Ben Tennyson must utilize the Omnitrix yet again in order to locate his missing Grandpa Max, accompanied by his cousin Gwen and former enemy Kevin 11.","Yuri Lowenthal, Dee Bradley Baker, Ashley Johnson, Greg Cipes",https://m.media-amazon.com/images/S/sash/4FyxwxECzL-U1J8.png
Superman: The Animated Series,"Animation, Action, Adventure",30 min,8.1,"16,951",(1996–2000),Certificate N/A,The last son of the planet Krypton protects his adoptive home of Earth as the greatest of the superheroes.,"Tim Daly, Joseph Bologna, Dana Delany, David Kaufman",https://m.media-amazon.com/images/S/sash/4FyxwxECzL-U1J8.png
The Suite Life on Deck,"Action, Adventure, Comedy",30 min,6.3,"20,628",(2008–2011),Certificate N/A,"Spinoff of the hit Disney Channel series ""The Suite Life of Zack & Cody,"" in which twin brothers Zack and Cody Martin and hotel heiress London Tipton enroll in a semester-at-sea program aboard a ship called the S.S. Tipton.","Dylan Sprouse, Cole Sprouse, Brenda Song, Debby Ryan",https://m.media-amazon.com/images/S/sash/4FyxwxECzL-U1J8.png
Daybreak,"Action, Adventure, Comedy",60 min,6.7,"22,289",(I) (2019),Certificate N/A,High school outcast Josh is searching for his missing girlfriend in post apocalyptic Glendale. He's joined by a group of misfits Angelica and his former bully Wesley. On the way they'll face many weird things.,"Colin Ford, Alyvia Alyn Lind, Sophie Simnett, Austin Crute",https://m.media-amazon.com/images/S/sash/4FyxwxECzL-U1J8.png
Samurai Chanpurû,"Animation, Action, Adventure",24 min,8.6,"52,769",(2004–2005),Certificate N/A,"Fuu, a waitress who works in a teahouse, rescues two master swordsmen, Mugen and Jin, from their execution to help her find the ""samurai who smells of sunflowers.""","Kazuya Nakai, Ginpei Sato, Ayako Kawasumi, Steve Blum",https://m.media-amazon.com/images/S/sash/4FyxwxECzL-U1J8.png
Expedition Bigfoot,Adventure,Run Time N/A,6.0,889,(2019– ),Certificate N/A,"Harrowing experience and pioneering endeavor in an undisclosed, remote location in a 90,000-acre swath of land in central Oregon.","Erik Thompson, Mireya Mayor, Bryce Johnson, Russell Acord",https://m.media-amazon.com/images/S/sash/4FyxwxECzL-U1J8.png
Naked and Afraid XL,"Adventure, Game-Show, Horror",42 min,7.3,"1,774",(2015– ),Certificate N/A,A group of amateur survivalists are put to the ultimate test in the wild for 40 days with nothing but a few primitive tools. No food. No clothing. No water. They must hunt and gather whatever they need until extraction day.,"Michael Brown, Jeff Zausch, Matt Wright, Steven Lee Hall Jr.",https://m.media-amazon.com/images/S/sash/4FyxwxECzL-U1J8.png
Knight Rider,"Adventure, Mystery, Thriller",60 min,5.6,"9,818",(2008–2009),Certificate N/A,"A former Army Ranger, an FBI agent and a young woman search for the culprits who want the crime-fighting car KITT.","Justin Bruening, Deanna Russo, Paul Campbell, Smith Cho",https://m.media-amazon.com/images/S/sash/4FyxwxECzL-U1J8.png
Star Wars: Young Jedi Adventures,"Animation, Action, Adventure",Run Time N/A,5.8,670,(2023– ),Certificate N/A,"It tells the story of Younglings as they go in adventures, and start their journeys to become Jedi Knights.","Jamaal Avery Jr., Juliet Donenfeld, Dee Bradley Baker, Emma Berman",https://m.media-amazon.com/images/S/sash/4FyxwxECzL-U1J8.png
The Spectacular Spider-Man,"Animation, Action, Adventure",23 min,8.4,"18,230",(2008–2009),Certificate N/A,"An animated television show that focuses on a sixteen-year-old Peter Parker, and the origins of Spider-Man.","Josh Keaton, Lacey Chabert, Joshua LeBar, Grey Griffin",https://m.media-amazon.com/images/S/sash/4FyxwxECzL-U1J8.png
Knightfall,"Action, Adventure, Drama",60 min,6.8,"21,598",(2017–2019),Certificate N/A,A look at the final days of the Knights Templar during the 14th century.,"Tom Cullen, Pádraic Delaney, Simon Merrells, Julian Ovenden",https://m.media-amazon.com/images/S/sash/4FyxwxECzL-U1J8.png
Knuckles,"Action, Adventure, Comedy",Run Time N/A,Rating N/A,Votes N/A,(2023– ),Certificate N/A,Knuckles The Echidna teaches deputy Wade Whipple the ways of the Echidna warrior so they can fight Shadow the Hedgehog.,"Tony Coughlan, Colleen O'Shaughnessey, Alfredo Tavares, Daniel Singh",https://m.media-amazon.com/images/S/sash/4FyxwxECzL-U1J8.png
Star Trek: Prodigy,"Animation, Action, Adventure",24 min,7.4,"4,597",(2021–2022),Certificate N/A,A group of enslaved teenagers steal a derelict Starfleet vessel to escape and explore the galaxy.,"Rylee Alazraqui, Dee Bradley Baker, Brett Gray, Angus Imrie",https://m.media-amazon.com/images/S/sash/4FyxwxECzL-U1J8.png
Children of Dune,"Adventure, Drama, Sci-Fi",266 min,7.3,"14,403",(2003),Certificate N/A,"The twins of Paul ""Muad'dib"" Atreides become embroiled in the political landscape of Arrakis (""Dune"") and the rest of the universe.","Alec Newman, Daniela Amavia, James McAvoy, Jessica Brooks",https://m.media-amazon.com/images/S/sash/4FyxwxECzL-U1J8.png
Star vs. the Forces of Evil,"Animation, Action, Adventure",22 min,7.9,"17,335",(2015–2019),Certificate N/A,"Star Butterfly arrives on Earth to live with the Diazes, a Mexican-American family. She continues to battle villains throughout the universe and high school, mainly to protect her extremely powerful wand, an object that still confuses her.","Eden Sher, Adam McArthur, Grey Griffin, Daron Nefcy",https://m.media-amazon.com/images/S/sash/4FyxwxECzL-U1J8.png
Cursed,"Adventure, Drama, Fantasy",60 min,6.0,"31,878",(2020),Certificate N/A,A teenage sorceress named Nimue encounters a young Arthur on her quest to find a powerful and ancient sword.,"Katherine Langford, Devon Terrell, Gustaf Skarsgård, Daniel Sharman",https://m.media-amazon.com/images/S/sash/4FyxwxECzL-U1J8.png
Goblin Slayer,"Animation, Action, Adventure",30 min,7.5,"9,190",(2018– ),Certificate N/A,"In a fantasy world, a lone hero makes his living by exterminating all goblins he encounters. But one day he meets a friend, and his life begins to become more intense.","Yûichirô Umehara, Yui Ogura, Brad Hawkins, Hayden Daviau",https://m.media-amazon.com/images/S/sash/4FyxwxECzL-U1J8.png
Kung Fu,"Action, Adventure, Drama",Run Time N/A,5.7,"4,930",(2021–2023),Certificate N/A,"A quarter-life crisis causes a young Chinese-American woman, Nicky Shen, to drop out of college and go on a life-changing journey to an isolated monastery in China. But when she returns to find her hometown overrun with crime and corruption, Nicky uses her martial arts skills and Shaolin values to protect her community and bring criminals to justice -- all while searching for the assassin who ...                See full summary »","Olivia Liang, Kheng Hua Tan, Eddie Liu, Shannon Dang",https://m.media-amazon.com/images/S/sash/4FyxwxECzL-U1J8.png
Overlord,"Animation, Action, Adventure",30 min,7.7,"12,399",(2015– ),Certificate N/A,"An office worker in a dystopian world logs onto a video game for the last time only to find out that he, along with his entire guild, has been transported to another reality.","Satoshi Hino, Chris Guerrero, Yumi Hara, Masayuki Katô",https://m.media-amazon.com/images/S/sash/4FyxwxECzL-U1J8.png
Are You Afraid of the Dark?,"Adventure, Drama, Fantasy",44 min,7.1,"2,646",(2019–2022),Certificate N/A,"An anthology series that follows different chapters of the Midnight Society, a group of teenagers who gather at midnight to tell scary stories, such as the Carnival of Doom, Curse of the Shadows, and Ghost Island.","Bryce Gheisar, Malia Baker, Beatrice Kitsos, Arjun Athalye",https://m.media-amazon.com/images/S/sash/4FyxwxECzL-U1J8.png
Ben 10: Omniverse,"Animation, Action, Adventure",22 min,6.3,"6,715",(2012–2014),Certificate N/A,"The continuing adventures of Ben Tennyson (Yuri Lowenthal) and his new partner, Rook Blonko (Bumper Robinson).","Yuri Lowenthal, Bumper Robinson, Eric Bauza, Paul Eiding",https://m.media-amazon.com/images/S/sash/4FyxwxECzL-U1J8.png
Into the West,"Adventure, Drama, Romance",552 min,8.0,"7,361",(2005),Certificate N/A,"Tales from the American West in the 19th century, told from the perspective of two families, one of white settlers and one of Native Americans.","Joseph M. Marshall, Irene Bedard, Gil Birmingham, John Terry",https://m.media-amazon.com/images/S/sash/4FyxwxECzL-U1J8.png
Baa Baa Black Sheep,"Action, Adventure, Drama",60 min,7.6,"3,226",(1976–1978),Certificate N/A,"The dramatized World War II adventures of U.S. Major Gregory ""Pappy"" Boyington and his U.S. Marine Attack Squadron 214, (The Black Sheep Squadron).","Robert Conrad, Simon Oakland, Dana Elcar, Dirk Blocker",https://m.media-amazon.com/images/S/sash/4FyxwxECzL-U1J8.png
Diabolical,"Animation, Short, Action",14 min,6.9,"15,032",(2022– ),Certificate N/A,A collection of animated short stories that takes place inside The Boys universe.,"Grey Griffin, Chris Diamantopoulos, Ben Schwartz, Antony Starr",https://m.media-amazon.com/images/S/sash/4FyxwxECzL-U1J8.png
BeastMaster,"Action, Adventure, Fantasy",43 min,6.2,"2,398",(1999–2002),Certificate N/A,The sword and sorcery adventures of a wandering adventurer who has the ability to communicate with animals.,"Daniel Goddard, Jackson Raine, Steven Grives, Monika Schnarre",https://m.media-amazon.com/images/S/sash/4FyxwxECzL-U1J8.png
Inhumans,"Action, Adventure, Sci-Fi",43 min,4.9,"28,126",(2017),Certificate N/A,An isolated community of superhumans fight to protect themselves.,"Anson Mount, Serinda Swan, Ken Leung, Eme Ikwuakor",https://m.media-amazon.com/images/S/sash/4FyxwxECzL-U1J8.png
The Ghost and Molly McGee,"Animation, Short, Adventure",22 min,7.5,"1,551",(2021– ),Certificate N/A,"A grumpy ghost named Scratch is eternally cursed to be in the presence of polar opposite Molly McGee, a cheerful tween.","Ashly Burch, Dana Snyder, Michaela Dietz, Jordan Klepper",https://m.media-amazon.com/images/S/sash/4FyxwxECzL-U1J8.png
Ben 10: Ultimate Alien,"Animation, Action, Adventure",22 min,7.7,"10,149",(2010–2012),Certificate N/A,"With his secret identity now revealed to the world, Ben Tennyson continues to fight evil as a superhero with the help of the newly acquired Ultimatrix.","Yuri Lowenthal, Ashley Johnson, Dee Bradley Baker, Chandu Kanuri",https://m.media-amazon.com/images/S/sash/4FyxwxECzL-U1J8.png
Yu-Gi-Oh!,"Animation, Action, Adventure",24 min,7.3,"22,564",(I) (2000–2006),Certificate N/A,"Yugi Moto solves an Ancient Egyptian Puzzle and brings forth a dark and powerful alter ego. Whenever he and his friends are threatened by evil in Duel Monster Card Game, this alter ego breaks out to save them.","Argiris Pavlidis, Dan Green, Wayne Grayson, Amy Birnbaum",https://m.media-amazon.com/images/S/sash/4FyxwxECzL-U1J8.png
Toy Boy,"Action, Adventure, Crime",Run Time N/A,6.5,"8,208",(2019– ),Certificate N/A,A stripper sets out to prove his innocence for a crime he didn't commit and was unjustly incarcerated for seven years earlier.,"Jesús Mosquera, Cristina Castaño, María Pedraza, Jose De la Torre",https://m.media-amazon.com/images/S/sash/4FyxwxECzL-U1J8.png
Birds of Prey,"Action, Adventure, Drama",60 min,6.4,"5,414",(2002–2003),Certificate N/A,"In the future, long after the Batman has driven himself into exile, his legacy lives on in the form of the Birds of Prey--Black Canary, Oracle, and the Huntress.","Ashley Scott, Dina Meyer, Rachel Skarsten, Shemar Moore",https://m.media-amazon.com/images/S/sash/4FyxwxECzL-U1J8.png
Mao Gakuin no Futekigosha,"Animation, Adventure, Comedy",23 min,7.3,"4,489",(2020–2023),Certificate N/A,A demon mage reincarnates into the body of his descendant hoping to find an era where he can have some peace and quiet. He ends up going to a school run by his significantly weaker descendants.,"Aleks Le, Kayli Mills, Brianna Knickerbocker, Griffin Puatu",https://m.media-amazon.com/images/S/sash/4FyxwxECzL-U1J8.png
The Greatest American Hero,"Adventure, Comedy, Sci-Fi",60 min,7.3,"6,315",(1981–1983),Certificate N/A,A teacher is asked to be a superhero using a special alien suit with powers he can barely understand or control.,"William Katt, Connie Sellecca, Robert Culp, Michael Paré",https://m.media-amazon.com/images/S/sash/4FyxwxECzL-U1J8.png
We Bare Bears,"Animation, Adventure, Comedy",30 min,7.9,"17,826",(2014–2019),Certificate N/A,Three bear brothers do whatever they can to be a part of human society by doing what everyone around them does.,"Eric Edelstein, Demetri Martin, Bobby Moynihan, Keith Ferguson",https://m.media-amazon.com/images/S/sash/4FyxwxECzL-U1J8.png
Naked and Afraid: Castaways,Adventure,Run Time N/A,7.4,56,(2023– ),Certificate N/A,"Nine competitors are left behind on a distant tropical island, far from civilization, with no maps or tools. They must swim in groups of 3 to different habitats on the island: a sun-baked beach, twisting mangrove swamp and a dark jungle.","Kerra Bennett, Patrick French, Justin Governale, Bulent Kemal Gurcan",https://m.media-amazon.com/images/S/sash/4FyxwxECzL-U1J8.png
Professionals,"Action, Adventure",48 min,5.5,"1,883",(2020– ),Certificate N/A,"After their advanced medical satellite explodes on deployment, billionaire futurist Peter Swann, and his fiancée, medical visionary Dr. Graciela ""Grace"" Davila, turn to a hardened former counterintelligence officer.","Tom Welling, Elena Anaya, Brendan Fraser, Ken Duken",https://m.media-amazon.com/images/S/sash/4FyxwxECzL-U1J8.png
Deadly Class,"Action, Adventure, Comedy",60 min,7.5,"18,710",(2018–2019),Certificate N/A,"A coming-of-age story set against the backdrop of late 1980s counterculture, which follows a disillusioned teen recruited into a storied high school for assassins.","Benedict Wong, Benjamin Wadsworth, Lana Condor, María Gabriela de Faría",https://m.media-amazon.com/images/S/sash/4FyxwxECzL-U1J8.png
Ninjago,"Animation, Action, Adventure",11 min,8.1,"1,843",(2019–2022),Certificate N/A,"While fighting foes across Ninjago City and beyond, the ninja embark on new quests and gain newfound allies as the power of their friendship is tested.","Sam Vincent, Michael Adamthwaite, Kelly Metzger, Vincent Tong",https://m.media-amazon.com/images/S/sash/4FyxwxECzL-U1J8.png
Batman: Caped Crusader,"Animation, Action, Adventure",Run Time N/A,8.8,21,(2023– ),Certificate N/A,Reimagining of the Batman mythology.,"Star:
Kevin Conroy",https://m.media-amazon.com/images/S/sash/4FyxwxECzL-U1J8.png
The Amazing Race,"Adventure, Family, Reality-TV",60 min,7.8,"15,116",(2001– ),Certificate N/A,"Multiple teams race around the globe for $1,000,000 to 'amazing' locations.","Phil Keoghan, Joyce Agu, Uchenna Agu, Jet McCoy",https://m.media-amazon.com/images/S/sash/4FyxwxECzL-U1J8.png
Bishôjo senshi Sêrâ Mûn,"Animation, Action, Adventure",30 min,7.7,"7,085",(1992–1997),Certificate N/A,"A group of schoolgirls discover they are incarnations of super-powered alien princesses, and use their abilities to defend the earth.","Stephanie Sheh, Kotono Mitsuishi, Kate Higgins, Aya Hisakawa",https://m.media-amazon.com/images/S/sash/4FyxwxECzL-U1J8.png
Dungeon ni Deai wo Motomeru no wa Machigatteiru Darou ka,"Animation, Action, Adventure",24 min,7.4,"9,583",(2015– ),Certificate N/A,"In the city of Orario, where adventurers hunt monsters in a place called Dungeon, Bell Cranel's life was saved by a swordswoman, who is then become the source of Bell's determination to get stronger.","Bryson Baugus, Yoshitsugu Matsuoka, Maaya Uchida, Luci Christian",https://m.media-amazon.com/images/S/sash/4FyxwxECzL-U1J8.png
Deadliest Catch,"Documentary, Adventure, Reality-TV",55 min,7.8,"9,030",(2005– ),Certificate N/A,A documentary series chronicling the real-life high-sea adventures of the Alaskan crab fishermen. This is the most deadly profession in the world.,"Mike Rowe, Sig Hansen, Keith Colburn, Jake Anderson",https://m.media-amazon.com/images/S/sash/4FyxwxECzL-U1J8.png
Killjoys,"Action, Adventure, Sci-Fi",42 min,7.2,"23,058",(2015–2019),Certificate N/A,"In the Quad, a planetary system on the brink of a bloody interplanetary class war, a fun loving trio of bounty hunters attempt to remain impartial as they chase deadly warrants.","Hannah John-Kamen, Aaron Ashmore, Luke Macfarlane, Tamsen McDonough",https://m.media-amazon.com/images/S/sash/4FyxwxECzL-U1J8.png
