Title,Genre,Run Time,Rating,Number of Votes,Year,Certificate,Synopsis,Actors,Image
Blue Demon,"Action, Adventure, Biography",46 min,7.7,90,(2016–2017),Certificate N/A,"The fictionalized life story of Mexican wrestler ""Blue Demon.""","Tenoch Huerta, Ana Brenda Contreras, Ianis Guerrero, Alejandro de Marino",https://m.media-amazon.com/images/S/sash/4FyxwxECzL-U1J8.png
Mary Bryant,"Adventure, Drama",480 min,7.3,"2,534",(2005–2007),R,A young woman is transported to the New South Wales penal colony in 1788.,"Romola Garai, Jack Davenport, Alex O'Loughlin, Sam Neill",https://m.media-amazon.com/images/S/sash/4FyxwxECzL-U1J8.png
Dinosaur Train,"Animation, Adventure, Family",28 min,6.5,"1,498",(2009–2023),Certificate N/A,"Friendly dinosaurs climb aboard a train to visit different times throughout the prehistoric age, learning about dinosaurs and having fun adventures.","Ian James Corlett, Erika-Shaye Gair, Claire Margaret Corlett, Ellen Kennedy",https://m.media-amazon.com/images/S/sash/4FyxwxECzL-U1J8.png
Transformers: Rescue Bots,"Animation, Short, Action",20 min,6.6,"1,055",(2011–2016),Certificate N/A,The Rescue Bots are Transformers that work with a family of heroes to rescue humans from disasters. These non-violent Transformer stories were aimed at pre-school viewers.,"Lacey Chabert, Elan Garfias, Maurice LaMarche, Jason Marsden",https://m.media-amazon.com/images/S/sash/4FyxwxECzL-U1J8.png
Power Rangers Turbo,"Action, Adventure, Family",30 min,5.6,"2,643",(1997–1998),Certificate N/A,Divatox has begun her invasion on Earth and the Power Rangers trade in their Zeo crystal powers for Turbo technology powers to combat this new threat.,"Blake Foster, Carol Hoyt, Donene Kistler, Derek Stephen Prince",https://m.media-amazon.com/images/S/sash/4FyxwxECzL-U1J8.png
Daniel Spellbound,"Animation, Action, Adventure",22 min,7.0,523,(2022– ),Certificate N/A,"Magic is real, but it's hidden from the public, Daniel knows where to find it. He discovers a strange ingredient, he gets the attention of dangerous alchemists which takes him to an adventure, while the magical world hangs in the balance.","Lynn Rafferty, Catherine Disher, Rainbow Sun Francks, Chantel Riley",https://m.media-amazon.com/images/S/sash/4FyxwxECzL-U1J8.png
Dead Boy Detectives,"Action, Adventure, Comedy",Run Time N/A,Rating N/A,Votes N/A,,Certificate N/A,"Follows Charles Rowland and Edwin Paine, who decided not to enter the afterlife to stay on earth and investigate crimes that involve supernatural stuff.","Briana Cuoco, Caitlin Reilly, Max Jenkins, Yuyu Kitamura",https://m.media-amazon.com/images/S/sash/4FyxwxECzL-U1J8.png
Supah Ninjas,"Action, Adventure, Comedy",30 min,5.6,"1,702",(2011–2023),Certificate N/A,"Three high school students - Mike Fukanaga, Owen Reynolds, and Amanda McKay - become ninjas with the help of Mike's grandpa.","Ryan Potter, Carlos Knight, Gracie Dzienny, George Takei",https://m.media-amazon.com/images/S/sash/4FyxwxECzL-U1J8.png
Klondike,"Adventure, Biography, Drama",274 min,7.3,"6,493",(2014),Certificate N/A,"Two childhood friends, Bill Haskell and Byron Epstein, embark on a journey to Klondike, Yukon, in hopes of discovering a fortune in a remote town.","Abbie Cornish, Marton Csokas, Ian Hart, Greg Lawson",https://m.media-amazon.com/images/S/sash/4FyxwxECzL-U1J8.png
Popeye the Sailor,"Animation, Adventure, Comedy",30 min,7.1,"13,357",(1960–1962),Certificate N/A,"The continuing animated adventures of Olive Oyl, Wimpy, Swee'pea and Popeye.","Jack Mercer, Mae Questel, Jackson Beck",https://m.media-amazon.com/images/S/sash/4FyxwxECzL-U1J8.png
Xavier: Renegade Angel,"Animation, Adventure, Comedy",12 min,7.9,"4,724",(2007–2009),Certificate N/A,"Xavier is a faun-like wanderer/seeker who is traveling across the land to find out the truth about his mysterious origin. Facing rednecks, inflicting righteousness and preaching about the 'strong, silent types' and morality, this hero has his work cut out for him.","Vernon Chatman, John Lee, Alyson Levy, Jim Tozzi",https://m.media-amazon.com/images/S/sash/4FyxwxECzL-U1J8.png
Robotech,"Animation, Action, Adventure",30 min,8.5,"3,902",(1985),Certificate N/A,An alien spaceship crash lands on Earth and the technology and secrets she bears lead Earth into three destructive interplanetary wars.,"Steve Kramer, Tom Wyner, Robert Axelrod, Bill Capizzi",https://m.media-amazon.com/images/S/sash/4FyxwxECzL-U1J8.png
Odissea,"Adventure, Drama, Fantasy",109 min,8.5,824,(1968),Certificate N/A,"Odysseus' journey told in Homer's Iliad and Odyssey. After fighting in the Trojan War, Odysseus spends years trying to return home to Itaka.","Bekim Fehmiu, Carlo Alighiero, Leonard Steckel, Constantin Andrieu",https://m.media-amazon.com/images/S/sash/4FyxwxECzL-U1J8.png
Babar,"Animation, Adventure, Comedy",30 min,6.4,"5,407",(1989–2002),Certificate N/A,"The adventures of the King of the elephants, his family, and friends.","Richard Binsley, Gordon Pinsent, Dawn Greenhalgh, Stuart Stone",https://m.media-amazon.com/images/S/sash/4FyxwxECzL-U1J8.png
Sassy the Sasquatch,"Animation, Adventure, Comedy",Run Time N/A,9.3,361,(2022),Certificate N/A,"The origin story for fictional character Sassy the Sasquatch from the YouTube cartoon series ""The Big Lez Show"".","Jarrad Wright, Matt Terechow, Tom Hollis, Danni Farmer",https://m.media-amazon.com/images/S/sash/4FyxwxECzL-U1J8.png
Taste the Nation with Padma Lakshmi,"Adventure, Reality-TV",30 min,8.1,680,(2020– ),Certificate N/A,"Host Padma Lakshmi takes audiences on a journey across America, exploring the rich and diverse food culture of various immigrant groups, seeking out the people who have so heavily shaped what American food is today.","Padma Lakshmi, Ali Wong, Maz Jobrani, Madhur Jaffrey",https://m.media-amazon.com/images/S/sash/4FyxwxECzL-U1J8.png
Monogatari Series: Second Season,"Animation, Adventure, Comedy",25 min,8.6,"2,820",(2013),Certificate N/A,"Walking to school one day Tsubasa Hanekawa encounters a huge white tiger apparition at a crossroads that talks to her. The next day her house burns down. Homeless, and not wanting to stay ...                See full summary »","Yôji Ueda, Saori Hayami, Kaori Mizuhashi, Ken Narita",https://m.media-amazon.com/images/S/sash/4FyxwxECzL-U1J8.png
Automan,"Adventure, Comedy, Crime",70 min,6.8,"2,028",(1983–1984),Certificate N/A,A computer-generated superhero and his human creator fight crime in the city.,"Desi Arnaz Jr., Chuck Wagner, Heather McNair, Gerald S. O'Loughlin",https://m.media-amazon.com/images/S/sash/4FyxwxECzL-U1J8.png
Spicy City,"Animation, Adventure, Crime",Run Time N/A,6.6,725,(1997),Certificate N/A,An anthology of sexy and risque animated stories in a futuristic city with a seamy side.,"Michelle Phillips, Charlie Adler, Letitia Hicks, James Keane",https://m.media-amazon.com/images/S/sash/4FyxwxECzL-U1J8.png
Masha i Medved,"Animation, Short, Adventure",7 min,7.5,"3,570",(2007– ),Certificate N/A,A retired circus bear settles into the woods and prepares for a quiet new life surrounded by peace and tranquility until he is introduced to an adventurous little girl named Masha.,"Boris Kutnevich, Alina Kukushkina, Kaitlyn McCormick, Varvara Sarantseva",https://m.media-amazon.com/images/S/sash/4FyxwxECzL-U1J8.png
The Magical Legend of the Leprechauns,"Adventure, Comedy, Family",139 min,7.0,"4,367",(1999),Certificate N/A,"An American spends his holiday in Ireland, where he is introduced to the world of magical creatures like leprechauns and fairies. In a subplot, a forbidden love story blossoms between leprechaun Mickey and fairy Jessica.","Randy Quaid, Whoopi Goldberg, Roger Daltrey, Colm Meaney",https://m.media-amazon.com/images/S/sash/4FyxwxECzL-U1J8.png
Power Rangers Lightspeed Rescue,"Action, Adventure, Drama",30 min,6.4,"2,138",(2000–2001),Certificate N/A,Five young adults are recruited by the Lightspeed Rescue organization to protect the city of Marnier Bay from the forces of evil.,"Michael Chaturantabut, Sean Cw Johnson, Alison MacInnis, Keith D. Robinson",https://m.media-amazon.com/images/S/sash/4FyxwxECzL-U1J8.png
Off the Map,"Action, Adventure, Drama",42 min,7.2,"5,243",(2011),Certificate N/A,A group of doctors from the US travel to work at a remote clinic in the South American tropics in an attempt to discover the true reasons they became doctors.,"Jonathan Castellanos, Valerie Cruz, Caroline Dhavernas, Jason George",https://m.media-amazon.com/images/S/sash/4FyxwxECzL-U1J8.png
Ultra Violet & Black Scorpion,"Action, Adventure, Comedy",25 min,5.7,322,(2022),Certificate N/A,"When a mysterious luchador mask chooses Violet, she becomes superhero Ultra Violet. Eager to become famous, Violet sets out on a mission to collab with the city's famous vigilante superhero, Black Scorpion","Scarlett Estevez, J.R. Villarreal, Marianna Burelli, Juan Alfonso",https://m.media-amazon.com/images/S/sash/4FyxwxECzL-U1J8.png
Buzz Lightyear of Star Command,"Animation, Action, Adventure",30 min,6.6,"3,848",(2000–2001),Certificate N/A,The further adventures of Buzz Lightyear as a Space Ranger of Star Command and his comrades.,"Patrick Warburton, Stephen Furst, Nicole Sullivan, Larry Miller",https://m.media-amazon.com/images/S/sash/4FyxwxECzL-U1J8.png
Super Crooks,"Animation, Action, Adventure",30 min,7.1,"3,000",(2021– ),Certificate N/A,Johnny Bolt recruits a group of ragtag supervillains for one last heist. Their target: A ruthless super-powered crime boss. What can go wrong?,"Jonah Scott, Kenjirô Tsuda, Abby Trott, Maaya Sakamoto",https://m.media-amazon.com/images/S/sash/4FyxwxECzL-U1J8.png
Hanyô no Yashahime,"Animation, Action, Adventure",Run Time N/A,7.1,"1,176",(2020– ),Certificate N/A,"An adventure following Sesshomaru's half-demon twin daughters, Towa and Setsuna, as they discover the mysteries of their past along with Moroha, the daughter of Inuyasha and Kagome.","Sara Matsumoto, Mikako Komatsu, Agostina Longo, Azusa Tadokoro",https://m.media-amazon.com/images/S/sash/4FyxwxECzL-U1J8.png
A Tale Dark & Grimm,"Animation, Action, Adventure",26 min,7.3,"1,714",(2021),Certificate N/A,Follow Hansel and Gretel as they walk out of their own story into a winding and wickedly witty tale full of strange -and scary- surprises.,"Raini Rodriguez, Andre Robinson, Scott Adsit, Ron Funches",https://m.media-amazon.com/images/S/sash/4FyxwxECzL-U1J8.png
Harry Potter: Hogwarts Tournament of Houses,"Short, Action, Adventure",Run Time N/A,4.8,"1,816",(2021– ),Certificate N/A,Superfans of Harry Potter are tested using their knowledge to compete for the coveted House Cup. Including a few special guest appearances.,"Helen Mirren, Luke Youngblood, Adriana Redding, Tom Felton",https://m.media-amazon.com/images/S/sash/4FyxwxECzL-U1J8.png
Treasure Island,"Action, Adventure, History",180 min,6.2,"6,245",(2012),Certificate N/A,"In 1765, young English boy Jim Hawkins gets involved with buccaneers during his quest to find pirate Captain Flint's treasure buried on a secret island.","Barnaby Kay, Elijah Wood, Madhur Mittal, Daniel Mays",https://m.media-amazon.com/images/S/sash/4FyxwxECzL-U1J8.png
Kadokyaputa Sakura,"Animation, Action, Adventure",30 min,8.0,"5,391",(1998–2000),Certificate N/A,"Sakura stumbled upon the book of Clow Cards in a library. Accidentally setting the magical cards loose, it's now up to Sakura to catch them all with her best friend Tomoyo, and Kerberos, the guardian of the cards.","Sakura Tange, Sam Vincent, Brian Drummond, Matt Hill",https://m.media-amazon.com/images/S/sash/4FyxwxECzL-U1J8.png
Supernatural Academy,"Animation, Adventure, Drama",23 min,6.9,791,(2022),Certificate N/A,"Mischa Jackson, who has been living in the human world unaware she has supernatural powers, is taken to a magic school against her will.","Gigi Saul Guerrero, Shannon Chan-Kent, Bethany Brown, Larissa Dias",https://m.media-amazon.com/images/S/sash/4FyxwxECzL-U1J8.png
The Banana Splits Adventure Hour,"Adventure, Animation, Family",60 min,7.3,"1,858",(1968–1970),Certificate N/A,"A pop group consisting of four anthropomorphic animals host a variety of cartoons, songs, and skits.","The Krofft Puppets, Frank Aletter, Kim Kahana, Jan-Michael Vincent",https://m.media-amazon.com/images/S/sash/4FyxwxECzL-U1J8.png
Muppet Babies,"Animation, Adventure, Comedy",25 min,7.5,"5,432",(1984–1991),Certificate N/A,"The Muppets, as babies, have adventures with their imaginations inside their nursery.","Greg Berg, Katie Leigh, Laurie O'Brien, Russi Taylor",https://m.media-amazon.com/images/S/sash/4FyxwxECzL-U1J8.png
Tekken: Bloodline,"Animation, Action, Adventure",22 min,6.6,"4,661",(2022),Certificate N/A,Follow Jin Kazama and his fight to become one of the best fighters in the King of the Iron Fist tournament.,"Kaiji Tang, S. Hiroshi Watanabe, Toshiyuki Morikawa, Taiten Kusunoki",https://m.media-amazon.com/images/S/sash/4FyxwxECzL-U1J8.png
Green Lantern: The Animated Series,"Animation, Action, Adventure",25 min,8.0,"7,281",(2011–2013),Certificate N/A,The further adventures of Hal Jordan and his comrades of the Green Lantern Corps.,"Josh Keaton, Kevin Michael Richardson, Jason Spisak, Grey Griffin",https://m.media-amazon.com/images/S/sash/4FyxwxECzL-U1J8.png
InuYasha: Kanketsu-hen,"Animation, Action, Adventure",24 min,8.5,"3,353",(2009–2010),Certificate N/A,"InuYasha's story draws to a close but not before finding Naraku and the Sacred Jewel, and facing new enemies and new dangers.","Kappei Yamaguchi, Satsuki Yukino, Kumiko Watanabe, Kôji Tsujitani",https://m.media-amazon.com/images/S/sash/4FyxwxECzL-U1J8.png
Halo: Nightfall,"Action, Adventure, Mystery",30 min,5.5,"5,558",(2014),Certificate N/A,"While investigating terrorist activity on the distant colony world of Sedra, Jameson Locke and his team are caught in a horrific biological attack that exposes them to a much deeper danger.","Steven Waddington, Siennah Buck, Mike Colter, Christian Contreras",https://m.media-amazon.com/images/S/sash/4FyxwxECzL-U1J8.png
Kenja no Mago,"Animation, Action, Adventure",24 min,6.8,"2,795",(2019– ),Certificate N/A,"A recently deceased young man is sent to another world and is taught magic by master Merlin. He quickly masters everything he is taught. However he has one fatal weakness, common sense.","Lindsay Seidel, Daman Mills, Katelyn Barr, Brandon McInnis",https://m.media-amazon.com/images/S/sash/4FyxwxECzL-U1J8.png
Kamen Rider Geats,"Action, Adventure, Comedy",25 min,8.3,303,(2022–2023),Certificate N/A,"The ""Desire Grand Prix"" is a game to protect the peace of the city from the threat of the mysterious enemy ""Jamato"", whose origin and purpose are unknown. Each participant transforms into a...                See full summary »","Hideyoshi Kan, Kazuto Mokudai, Kokoro Aoshima, Yuna Hoshino",https://m.media-amazon.com/images/S/sash/4FyxwxECzL-U1J8.png
Spider-Man Unlimited,"Animation, Action, Adventure",22 min,6.3,"3,809",(1999–2005),Certificate N/A,Spider-Man travels to Counter-Earth to rescue a Terran shuttle crew trapped there and discovers a tyrannical and warped version of his world.,"Rino Romano, Kathleen Barr, Jim Byrnes, Garry Chalk",https://m.media-amazon.com/images/S/sash/4FyxwxECzL-U1J8.png
Brandy & Mr. Whiskers,"Animation, Adventure, Comedy",30 min,6.3,"3,172",(2004–2007),Certificate N/A,A snobbish dog named Brandy Harrington and a dim-witted rabbit named Mr. Whiskers try to make the best of things when they get stranded in the Amazon rainforest together.,"Charlie Adler, Kaley Cuoco, Tom Kenny, Alanna Ubach",https://m.media-amazon.com/images/S/sash/4FyxwxECzL-U1J8.png
The Girl from U.N.C.L.E.,"Action, Adventure, Comedy",60 min,6.6,503,(1966–1967),Certificate N/A,The missions of agent April Dancer of the United Network Command for Law and Enforcement.,"Stefanie Powers, Noel Harrison, Leo G. Carroll, Randy Kirby",https://m.media-amazon.com/images/S/sash/4FyxwxECzL-U1J8.png
Shinchô yûsha ~ kono yûsha ga ore TUEEE kuse ni shinchô sugiru ~,"Animation, Action, Adventure",23 min,7.3,"3,266",(2019),Certificate N/A,"The goddess Rista summons a hero to help her hard mode video game-like world. The hero, Seiya, is exceptional in every way, but he is incredibly cautious. He does things like buy three sets...                See full summary »","Yûichirô Umehara, Aki Toyosaki, Jamie Marchi, Anthony Bowling",https://m.media-amazon.com/images/S/sash/4FyxwxECzL-U1J8.png
Dinotopia,"Adventure, Family, Fantasy",60 min,6.4,"1,622",(I) (2002–2003),Certificate N/A,"The show serves as a sequel to Dinotopia (2002) and adds a new threat to the world of Dinotopia in the form of outlaws knows as the Outsiders, as well as more dinos.","Michael Brandon, Jonathan Hyde, Georgina Rylance, Shiloh Strong",https://m.media-amazon.com/images/S/sash/4FyxwxECzL-U1J8.png
The Healing Powers of Dude,"Short, Action, Adventure",25 min,6.6,"1,063",(2020),Certificate N/A,"Noah, an 11-year-old boy with social anxiety disorder, has to start middle school, he turns to a mutt named Dude, a sarcastic emotional support dog who might need Noah as much as Noah needs him.","Jace Chapman, Larisa Oleynik, Mauricio Lara, Sophie Kim",https://m.media-amazon.com/images/S/sash/4FyxwxECzL-U1J8.png
Fallout: Revelation,"Adventure, Drama, Sci-Fi",Run Time N/A,7.5,56,(2016– ),Certificate N/A,"A mysterious object found in the wasteland brings havoc to peaceful vault-dweller, Aldous Mercury.","Samuel Vargas, Luke Anthony, Mitchell Newell, Don Scribner",https://m.media-amazon.com/images/S/sash/4FyxwxECzL-U1J8.png
Isekai wa smartphone to tomo ni.,"Animation, Adventure, Comedy",24 min,6.5,"2,614",(2017–2023),Certificate N/A,"When a boy is accidentally killed by God, he is resurrected in another world as recompense with his magically enhanced smartphone being only the first of his gifts there.","Jill Harris, Leah Clark, Katsumi Fukuhara, Marika Kôno",https://m.media-amazon.com/images/S/sash/4FyxwxECzL-U1J8.png
Galactik Football,"Animation, Action, Adventure",26 min,7.7,"3,410",(2006–2011),Certificate N/A,A new generation of once great team is ready to regain old glory in the amazing space football tournament.,"Gavin O'Connor, Michael Ford-FitzGerald, Jonathan Ryan, Dominic Catrambone",https://m.media-amazon.com/images/S/sash/4FyxwxECzL-U1J8.png
Knight Squad,"Adventure, Comedy, Family",30 min,5.4,674,(2018–2019),Certificate N/A,Two mismatched students form an unlikely alliance to protect each other's secret and pursue their dreams at a magical school for knights in training.,"Owen Patrick Joyner, Daniella Perkins, Lilimar, Lexi DiBenedetto",https://m.media-amazon.com/images/S/sash/4FyxwxECzL-U1J8.png
The Baby-Sitters Club,"Adventure, Comedy, Family",366 min,7.4,713,(1990),Certificate N/A,"Based on the popular series of children's books, this show follows the ups and downs of a young teen business club for babysitters.","Meghan Andrews, Melissa Chasse, Avriel Hillman, Meghan Lahey",https://m.media-amazon.com/images/S/sash/4FyxwxECzL-U1J8.png
The Legend of Zelda,"Animation, Action, Adventure",15 min,6.0,"1,961",(1989),Certificate N/A,"Based on the popular Nintendo game of the same name. Link and Princess Zelda protect the mystical artifact, the Triforce of Wisdom, from falling into the hands of the evil sorcerer Ganon.","Cynthia Preston, Jonathan Potts, Tabitha St. Germain, Len Carlson",https://m.media-amazon.com/images/S/sash/4FyxwxECzL-U1J8.png
El Tigre: The Adventures of Manny Rivera,"Animation, Short, Action",Run Time N/A,6.3,"1,950",(2007–2008),Certificate N/A,"The daily adventures of a 12 year old Mexican superhero dealing with bizarre enemies, as well as his own superhero father and villain grandfather.","Alanna Ubach, Grey Griffin, Eric Bauza, Carlos Alazraqui",https://m.media-amazon.com/images/S/sash/4FyxwxECzL-U1J8.png
Back to the Future,"Animation, Adventure, Family",23 min,6.3,"1,748",(1991–1993),Certificate N/A,"The time travelling adventures of Doc Brown, his family, and his friend, Marty McFly.","David Kaufman, Dan Castellaneta, Tom Wilson, Bill Nye",https://m.media-amazon.com/images/S/sash/4FyxwxECzL-U1J8.png
Street Sharks,"Animation, Action, Adventure",22 min,6.2,"2,791",(1994–1997),Certificate N/A,"Ripster, Jab, Streex and Slammu must protect their reputations and change the way they are being viewed in Fission City. They must fight Dr. Piranoid as well as finding their father once and for all...","Andrew Rannells, D. Kevin Williams, Jim Hoggatt, Lee Tockar",https://m.media-amazon.com/images/S/sash/4FyxwxECzL-U1J8.png
The Pirates of Dark Water,"Animation, Action, Adventure",30 min,8.3,"2,795",(1991–1992),Certificate N/A,A young man learns that he is a Prince with an urgent quest to save his world by finding thirteen magical treasures of rule.,"Jodi Benson, Frank Welker, George Newbern, Hector Elizondo",https://m.media-amazon.com/images/S/sash/4FyxwxECzL-U1J8.png
OK K.O.! Let's Be Heroes,"Animation, Short, Action",11 min,6.8,"3,318",(2017–2019),Certificate N/A,"An enthusiastic young boy earns a job at a hero supply store and trains to become the ""Greatest Hero Ever.""","Courtenay Taylor, Ashly Burch, Ian Jones-Quartey, David Herman",https://m.media-amazon.com/images/S/sash/4FyxwxECzL-U1J8.png
"Shin no Nakama ja Nai to Yuusha no Party o Oidasareta node, Henkyou de Slow Life Suru Koto ni Shimashita","Animation, Adventure, Comedy",25 min,6.7,"1,277",(2021– ),Certificate N/A,"Red was once a member of the Hero's party, a powerful group destined to save the world from the evil forces of Taraxon, the Raging Demon Lord. That is, until one of his comrades kicked him ...                See full summary »","Ryôta Suzuki, Kanon Takao, Nazeeh Tarsha, Naomi Ohzora",https://m.media-amazon.com/images/S/sash/4FyxwxECzL-U1J8.png
"Ready, Steady, Wiggle!","Adventure, Family, Fantasy",11 min,7.9,179,(2013–2023),Certificate N/A,"Ready, Steady, Wiggle is a brand new series from the early childhood entertainment specialists, The Wiggles. Featuring brand new songs, along with fresh interpretations of classics.","Anthony Field, Lachlan Gillespie, Simon Pryce, Paul Paddick",https://m.media-amazon.com/images/S/sash/4FyxwxECzL-U1J8.png
True Women,"Action, Adventure, Biography",183 min,6.6,"2,419",(1997),PG-13,"Covering nearly fifty years of mid-19th-century turmoil, from the tumultuous Texas Revolution to the early women's suffrage movement, ""True Women"" is a gripping tale of endurance, love, and above all, gritty female determination.","Dana Delany, Annabeth Gish, Angelina Jolie, Michael York",https://m.media-amazon.com/images/S/sash/4FyxwxECzL-U1J8.png
The Fantastic Journey,"Adventure, Fantasy, Sci-Fi",60 min,7.1,661,(1977),Certificate N/A,"Travelers are stranded in the Bermuda Triangle. On an island, they meet Varian, a man from the future, and Liana, an Atlantean. Together, they journey through different worlds, in hopes of returning home.","Jared Martin, Carl Franklin, Ike Eisenmann, Katie Saylor",https://m.media-amazon.com/images/S/sash/4FyxwxECzL-U1J8.png
Digimon Adventure,"Animation, Action, Adventure",24 min,6.8,691,(2020–2021),Certificate N/A,Taichi is preparing for a summer camping trip until he encounters a strange phenomenon that sweeps him up into the Digital World along with the other DigiDestined.,"Cherami Leigh, Zeno Robinson, Ben Diskin, Tara Sands",https://m.media-amazon.com/images/S/sash/4FyxwxECzL-U1J8.png
Debbe Dunning's Dude Ranch Roundup,Adventure,23 min,8.0,25,(2017– ),Certificate N/A,Debbe Dunning travels the country in search of western lifestyle and outdoor adventure at some of the most rustic and luxurious Dude Ranches across the United States.,"Debbe Dunning, Sysco Timmons, Spencer Timmons, Ross Knox",https://m.media-amazon.com/images/S/sash/4FyxwxECzL-U1J8.png
Polly Pocket,"Animation, Adventure, Comedy",22 min,6.1,156,(2018– ),Certificate N/A,"Polly is often told she is ""TOO LITTLE"" to do the things she wants to do, but Polly proves what every kid knows - that being little isn't a limitation; IT'S HER GREATEST STRENGTH. When ...                See full summary »","Agostina Longo, Emily Tennant, Shannon Chan-Kent, Kazumi Evans",https://m.media-amazon.com/images/S/sash/4FyxwxECzL-U1J8.png
Flying High,"Adventure, Comedy, Drama",60 min,6.7,133,(1978–1979),Certificate N/A,The high-flying adventures of three sexy airline stewardesses.,"Connie Sellecca, Pat Klous, Kathryn Witt, Howard Platt",https://m.media-amazon.com/images/S/sash/4FyxwxECzL-U1J8.png
Little Witch Academia,"Animation, Adventure, Comedy",25 min,7.8,"3,786",(2017),Certificate N/A,"Akko enrolls at the Luna Nova Witchcraft Academy. She's not the best student, but her bright attitude is the key to her and her friends' success.","Megumi Han, Erica Mendez, Alexis Nichols, Fumiko Orikasa",https://m.media-amazon.com/images/S/sash/4FyxwxECzL-U1J8.png
Chuggington,"Animation, Adventure, Comedy",10 min,5.9,636,(2008–2021),Certificate N/A,"Follow the adventures of Koko, Wilson and Brewster, three engines-in-training learning to ride the rails of life to become full-fledged chuggers.","Brigid Harrington, Imogen Bailey, Tony Terraciano, Morgan Overton",https://m.media-amazon.com/images/S/sash/4FyxwxECzL-U1J8.png
Goof Troop,"Animation, Short, Adventure",22 min,6.8,"9,100",(1992–1993),Certificate N/A,"The classic Disney character Goofy is a single father raising his son, Max, in Spoonerville. Pete, a frequent antagonist from the old cartoons, lives next door with his family.","Rob Paulsen, April Winchell, Jim Cummings, Bill Farmer",https://m.media-amazon.com/images/S/sash/4FyxwxECzL-U1J8.png
The Beast,"Action, Adventure, Horror",176 min,5.8,"2,844",(1996),PG-13,"Mysterious things happen at the coast of Graves Point: An empty boat lies at the shore, divers vanish. The sea biologist Dr. Talley thinks he knows the solution of the mystery: In the depth there is a gigantic squid.","William Petersen, Karen Sillas, Charles Martin Smith, Ronald Guttman",https://m.media-amazon.com/images/S/sash/4FyxwxECzL-U1J8.png
