Title,Genre,Run Time,Rating,Number of Votes,Year,Certificate,Synopsis,Actors,Image
La Fortuna,"Adventure, Thriller",60 min,6.5,"1,561",(2021),Certificate N/A,"Alex Ventura, a young and inexperienced diplomat, has inadvertently become the leader of a mission that will test all of his convictions: to recover the undersea treasure stolen by adventurer Frank Wild.","Álvaro Mel, Ana Polvorosa, Clarke Peters, Stanley Tucci",https://m.media-amazon.com/images/S/sash/4FyxwxECzL-U1J8.png
Life Below Zero,"Documentary, Adventure, Reality-TV",44 min,7.9,"2,141",(2013– ),Certificate N/A,The everyday struggles of living in the secluded state of Alaska where one wrong decision could cost you your life.,"James Franzo, Agnes Hailstone, Sue Aikens, Chip Hailstone",https://m.media-amazon.com/images/S/sash/4FyxwxECzL-U1J8.png
Dragon Ball GT: Doragon bôru jîtî,"Animation, Action, Adventure",24 min,6.8,"28,093",(1996–1997),Certificate N/A,"After Goku is made a kid again by the Black Star Dragon Balls, he goes on a journey to get back to his old self.","Elise Baughman, Andrew Chandler, Masako Nozawa, Yûko Minaguchi",https://m.media-amazon.com/images/S/sash/4FyxwxECzL-U1J8.png
The Adventures of Sinbad,"Fantasy, Action, Adventure",60 min,7.0,"2,130",(1996–1998),Certificate N/A,The Adventures of Sindbad across the seven seas in a brand new version. Sindbad and his shipmates encounter a numerous strange and dangerous situations on their journey but they always find...                See full summary »,"Zen Gesner, George Buza, Tim Progosh, Oris Erhuero",https://m.media-amazon.com/images/S/sash/4FyxwxECzL-U1J8.png
Project Fear,"Adventure, History, Horror",Run Time N/A,8.9,96,(2023– ),Certificate N/A,"After the devastating cancellation of their hit show, ""Destination Fear"", Dakota, Chelsea, Tanner, and Alex rule out the option of ending their terrifying road trips and continue their ...                See full summary »","Chelsea Laden, Dakota Laden, Alex Schroeder, Tanner Wiseman",https://m.media-amazon.com/images/S/sash/4FyxwxECzL-U1J8.png
The Wiggles,"Adventure, Comedy, Family",30 min,5.9,997,(1993–2022),Certificate N/A,"Get ready to Wiggle with the Wiggles' TV series. Wiggle fans can join in on the fun with the beloved quartet Anthony, Murray, Greg and Jeff.","Murray Cook, Jeff Fatt, Anthony Field, Greg Page",https://m.media-amazon.com/images/S/sash/4FyxwxECzL-U1J8.png
Creeped Out,"Action, Adventure, Crime",30 min,6.6,"2,216",(2017–2019),Certificate N/A,"Creeped Out is a series of spellbinding, enchanting, intriguing tales. Each episode is a different story set in a different place and time, with different characters exploring their way through the unexplained.","Victoria Diamond, William Romain, Jaiden Cannatelli, Lukas Engel",https://m.media-amazon.com/images/S/sash/4FyxwxECzL-U1J8.png
The Hitchhiker's Guide to the Galaxy,"Adventure, Comedy, Sci-Fi",152 min,8.0,"11,476",(1981),Certificate N/A,"Arthur Dent and his friend, Ford Prefect, escape the destruction of Earth, only to face incredible trials, tribulations and adventures in space and time.","Simon Jones, David Dixon, Peter Jones, Sandra Dickinson",https://m.media-amazon.com/images/S/sash/4FyxwxECzL-U1J8.png
Watership Down,"Animation, Action, Adventure",204 min,7.2,"6,695",(2018),Certificate N/A,"Fleeing their doomed warren, a colony of rabbits struggle to find and defend a new home.","James McAvoy, Nicholas Hoult, John Boyega, Ben Kingsley",https://m.media-amazon.com/images/S/sash/4FyxwxECzL-U1J8.png
The Luminaries,"Adventure, Drama, Mystery",60 min,6.4,"4,082",(2020),Certificate N/A,"Adventure mystery set in the midst of New Zealand's 1860's gold rush period. It has all the stuff that makes a good drama: murder, love and revenge, as men and women travel the world making their fortunes.","Eve Hewson, Eva Green, Himesh Patel, Marton Csokas",https://m.media-amazon.com/images/S/sash/4FyxwxECzL-U1J8.png
Lilo & Stitch: The Series,"Animation, Action, Adventure",22 min,6.8,"11,017",(2003–2006),Certificate N/A,The rambunctious human and alien duo must hunt down Dr. Jumba Jookiba's 625 other experimental creatures infesting Hawaii.,"Daveigh Chase, Chris Sanders, David Ogden Stiers, Kevin McDonald",https://m.media-amazon.com/images/S/sash/4FyxwxECzL-U1J8.png
Underground,"Adventure, Drama, History",43 min,7.9,"5,431",(2016–2017),Certificate N/A,"With the country on the brink of Civil War, the struggle for freedom is more dangerous than ever. Underground follows the story of American heroes and their moving journey to freedom.","Jurnee Smollett, Aldis Hodge, Jessica De Gouw, Alano Miller",https://m.media-amazon.com/images/S/sash/4FyxwxECzL-U1J8.png
Fûun! Takeshi Jô,"Action, Adventure, Comedy",Run Time N/A,8.2,"1,715",(1986–1989),Certificate N/A,"A game show where upwards of 100 contestants (give or take) try to get through various wet, dirty, and wild obstacles and games for a chance to win the grand prize of 1 million yen (Approx. $10,000) by defeating Takeshi and his crew.","Takeshi Kitano, Hayato Tani, Michiru Jo, Bradley Jay Lesley",https://m.media-amazon.com/images/S/sash/4FyxwxECzL-U1J8.png
Chowder,"Animation, Short, Adventure",11 min,7.4,"15,019",(2007–2010),Certificate N/A,"In Marzipan City, the young, excitable food-loving Chowder is the apprentice of Mung Daal, a very old chef who runs a catering company with his wife, Truffles and assistant, Shnitzel.","Nicky Jones, Dwight Schultz, John DiMaggio, Tara Strong",https://m.media-amazon.com/images/S/sash/4FyxwxECzL-U1J8.png
Koala Man,"Animation, Action, Adventure",25 min,6.8,"1,757",(2023– ),Certificate N/A,A powerless superhero and family patriarch in an Australian suburb lives a not-so-secret identity as Koala Man while possessing a burning passion to snuff out petty crime and bring order to the community.,"Michael Cusack, Sarah Snook, Demi Lardner, Hugh Jackman",https://m.media-amazon.com/images/S/sash/4FyxwxECzL-U1J8.png
Earth 2,"Adventure, Sci-Fi",60 min,6.9,"5,382",(1994–1995),Certificate N/A,"Colonists, crash-landed on an alien planet, begin the long trek to their originally designated landing place, facing alien and human threats.","Debrah Farentino, Clancy Brown, Sullivan Walker, Jessica Steen",https://m.media-amazon.com/images/S/sash/4FyxwxECzL-U1J8.png
Doug,"Animation, Adventure, Comedy",30 min,7.4,"19,663",(1991–1994),Certificate N/A,"The life of a young boy as he meets friends, falls in love, maneuvers his way through grade 6 and writes all about it in his journal.","Billy West, Fred Newman, Constance Shulman, Doug Preis",https://m.media-amazon.com/images/S/sash/4FyxwxECzL-U1J8.png
Kung Fu Panda: Legends of Awesomeness,"Animation, Action, Adventure",22 min,7.0,"7,183",(2011–2016),Certificate N/A,The further adventures of Po the Dragon Warrior and his friends.,"Mick Wingert, Kari Wahlgren, Fred Tatasciore, Max Koch",https://m.media-amazon.com/images/S/sash/4FyxwxECzL-U1J8.png
Zeke and Luther,"Action, Adventure, Comedy",30 min,6.3,"3,749",(2009–2012),Certificate N/A,Two best friends set their sights on becoming the world's greatest skateboarders.,"Hutch Dano, Adam Hicks, Daniel Curtis Lee, Ryan Whitney",https://m.media-amazon.com/images/S/sash/4FyxwxECzL-U1J8.png
Beast Wars: Transformers,"Animation, Action, Adventure",30 min,8.1,"8,493",(1996–1999),Certificate N/A,"The Transformers' war continues in an older time, through a new generation. On pliocenic Earth, the heroic Maximals and the evil Predacons battle for survival against each other and against a violent planet.","Scott McNeil, Andrea Libman, Garry Chalk, Ian James Corlett",https://m.media-amazon.com/images/S/sash/4FyxwxECzL-U1J8.png
Land of the Lost,"Adventure, Family, Comedy",23 min,6.9,976,(1991–1992),Certificate N/A,A family is trapped in a dinosaur dominated alternative world and must struggle to survive it.,"Timothy Bottoms, Jenny Drugan, Robert Gavin, Ed Gale",https://m.media-amazon.com/images/S/sash/4FyxwxECzL-U1J8.png
"Seija Musou: Salaryman, Isekai de Ikinokoru Tame ni Ayumu Michi","Animation, Adventure, Fantasy",Run Time N/A,6.5,113,(2023– ),Certificate N/A,"Earth's God of Destiny lost to Galdardia's Chief God for a bet and chose ten souls to hand over. Galdardia's Chief God handed those ten souls new vessels. Among those souls was Luciel, a salaryman, who fought against his destiny of death.","Reiji Kawashima, Justin Briner, Shinya Takahashi, Manaka Iwami",https://m.media-amazon.com/images/S/sash/4FyxwxECzL-U1J8.png
Xian Wang de Richang Shenghuo,"Animation, Action, Adventure",18 min,7.2,"2,090",(2020– ),Certificate N/A,"Wang Ling is a near-invincible existence with powers far beyond his control. But now that he's sixteen, he faces his greatest battle yet - Senior High School.","Zhao Shuang, Alex Mai, Erica Muse, Nazeeh Tarsha",https://m.media-amazon.com/images/S/sash/4FyxwxECzL-U1J8.png
Kami no Tou,"Animation, Action, Adventure",23 min,7.6,"6,693",(2020),Certificate N/A,"Reach the top, and everything will be yours. At the top of the tower exists everything in this world, and all of it can be yours.","Johnny Yong Bosch, Matthew David Rudd, Cherami Leigh, Scott Whyte",https://m.media-amazon.com/images/S/sash/4FyxwxECzL-U1J8.png
Pancho Villa. El Centauro del Norte,"Action, Adventure, Biography",44 min,7.3,191,(2023– ),Certificate N/A,Chronicle of Pancho Villa during his journey from bandit to revolutionary.,"Jorge A. Jimenez, Juan Luis Medina, Andrés Montiel, Marco Treviño",https://m.media-amazon.com/images/S/sash/4FyxwxECzL-U1J8.png
We Baby Bears,"Animation, Adventure, Comedy",11 min,6.1,492,(2022– ),Certificate N/A,"The bear siblings, Grizz, Panda and Ice Bear, in different locations around the world, on their journey to find a perfect permanent home.","Amari McCoy, Demetri Martin, Connor Andrade, Max Mitchell",https://m.media-amazon.com/images/S/sash/4FyxwxECzL-U1J8.png
The Croods: Family Tree,"Animation, Adventure, Comedy",22 min,6.8,"3,451",(2021– ),Certificate N/A,It continues the evolving story of the croods and Bettermans as they learn to live together on the most idle farm in prehistory.,"Ally Dixon, Kiff VandenHeuvel, Matthew Waterson, Amy Rosoff",https://m.media-amazon.com/images/S/sash/4FyxwxECzL-U1J8.png
Poyraz Karayel,"Action, Adventure, Comedy",120 min,8.2,"9,832",(2015–2017),Certificate N/A,"A defamed ex-cop, who is struggling to get back his son, is put on undercover duty within the biggest mafia in Istanbul.","Ilker Kaleli, Burçin Terzioglu, Musa Uzunlar, Ali Il",https://m.media-amazon.com/images/S/sash/4FyxwxECzL-U1J8.png
Generator Rex,"Animation, Action, Adventure",24 min,7.6,"7,169",(2010–2013),Certificate N/A,"In a future where humans are infected by untested, microscopic robots, a young man with the ability to control the bots helps a government agency control the tech's vicious creations.","Daryl Sabara, Grey Griffin, John DiMaggio, Wally Kurth",https://m.media-amazon.com/images/S/sash/4FyxwxECzL-U1J8.png
Broken Trail,"Action, Adventure, Drama",184 min,7.7,"6,572",(2006),Certificate N/A,A veteran cowboy and his nephew save five Chinese girls from prostitution while trekking from Oregon to Wyoming.,"Robert Duvall, Thomas Haden Church, Greta Scacchi, Chris Mulkey",https://m.media-amazon.com/images/S/sash/4FyxwxECzL-U1J8.png
An Idiot Abroad,"Documentary, Adventure, Comedy",43 min,8.3,"33,670",(2010–2012),Certificate N/A,British comedy duo Ricky Gervais and Stephen Merchant send their simple and closed-minded friend Karl Pilkington on a trip around the world to experience a variety of people and cultures.,"Karl Pilkington, Ricky Gervais, Stephen Merchant, Richard Yee",https://m.media-amazon.com/images/S/sash/4FyxwxECzL-U1J8.png
Daktari,"Adventure, Family",60 min,7.0,"1,111",(1966–1969),Certificate N/A,"Dr. Marsh Tracy was a veterinarian running an animal study center in Africa. Helping him were his daughter Paula, American Jack Dane, and Mike, a local. Also living with the Tracys, and ...                See full summary »","Marshall Thompson, Cheryl Miller, Judy the Chimpanzee, Clarence",https://m.media-amazon.com/images/S/sash/4FyxwxECzL-U1J8.png
Power Rangers Samurai,"Action, Adventure, Comedy",22 min,5.1,"2,641",(2011–2012),Certificate N/A,Five teenagers inherit samurai powers from ancient Japan to protect the world from an army of monsters.,"Alexander P. Heartman, Erika Fong, Hector David Jr., Najee De-Tiege",https://m.media-amazon.com/images/S/sash/4FyxwxECzL-U1J8.png
Q-Force,"Animation, Action, Adventure",30 min,6.7,"6,236",(2021),Certificate N/A,A handsome secret agent and his team of LGBTQ superspies embark on extraordinary adventures.,"Gary Cole, David Harbour, Patti Harrison, Sean Hayes",https://m.media-amazon.com/images/S/sash/4FyxwxECzL-U1J8.png
The Mole,"Adventure, Game-Show, Mystery",45 min,7.6,"3,372",(2022– ),Certificate N/A,It follows twelve players as they work together in challenges to add money to a pot that only one of them will win.,"Alex Wagner, William James Richardson, Joi Schweitzer, Kesi Neblett",https://m.media-amazon.com/images/S/sash/4FyxwxECzL-U1J8.png
Isekai Meikyuu de Harem o,"Animation, Action, Adventure",24 min,6.3,"1,201",(2022– ),Certificate N/A,A high school student is transported to a fantasy world with distinct cheating advantages. He sets out on a quest to gain a harem of beautiful girls.,"Taku Yashiro, Shiori Mikami, Kenta Miyake, Hayato Fujii",https://m.media-amazon.com/images/S/sash/4FyxwxECzL-U1J8.png
Sicak Kafa,"Adventure, Drama, Mystery",60 min,7.1,"6,736",(2022),Certificate N/A,"In a dystopian world, as an epidemic spreads through verbal communication, a tyrannical institution pursues a linguist immune to the disease.","Osman Sonant, Sevket Çoruh, Hazal Subasi, Kubilay Tunçer",https://m.media-amazon.com/images/S/sash/4FyxwxECzL-U1J8.png
Gremlins: Secrets of the Mogwai,"Animation, Adventure, Comedy",30 min,7.1,540,(2022– ),Certificate N/A,The adventures of Sam Wing in his youth and Gizmo the Mogwai in China.,"Gabrielle Nevaeh, A.J. LoCascio, Matthew Rhys, Izaac Wang",https://m.media-amazon.com/images/S/sash/4FyxwxECzL-U1J8.png
Mars,"Adventure, Drama, Sci-Fi",60 min,7.4,"15,032",(2016–2018),Certificate N/A,The first manned mission from Earth to Mars in 2033 attempts to colonize the red planet.,"Jihae, Alberto Ammann, Sammi Rotibi, Clémentine Poidatz",https://m.media-amazon.com/images/S/sash/4FyxwxECzL-U1J8.png
Criminal Minds: Suspect Behavior,"Action, Adventure, Crime",42 min,6.2,"5,611",(2011),Certificate N/A,On the streets of San Francisco a team of the Federal Bureau of Investigation's Behavioral Analysis Unit use profiling to catch some of the most horrific serial killers and unidentifiable subjects.,"Forest Whitaker, Janeane Garofalo, Michael Kelly, Beau Garrett",https://m.media-amazon.com/images/S/sash/4FyxwxECzL-U1J8.png
Star Blazers,"Animation, Action, Adventure",22 min,8.4,"1,513",(1979–1984),Certificate N/A,"In the year 2199, a starship must make a dangerous voyage to the distant planet Iscandar and back to save Earth from an alien invasion.","Eddie Allen, Michael Bertolini, Amy Howard Wilson, Lydia Leeds",https://m.media-amazon.com/images/S/sash/4FyxwxECzL-U1J8.png
The Octonauts,"Animation, Adventure, Comedy",11 min,7.6,"1,322",(2010–2021),Certificate N/A,"An intrepid band of explorers roam the oceans in search of adventure and fun. Led by a valiant polar bear and a daredevil kitten, these eight talented critters are always ready to embark on an exciting new mission.","Ross Breen, Keith Wickham, Simon Greenall, Jo Wyatt",https://m.media-amazon.com/images/S/sash/4FyxwxECzL-U1J8.png
Attila,"Action, Adventure, Biography",177 min,6.6,"10,923",(2001),Certificate N/A,"In 400 AD, the Roman Empire is the greatest power in the world. But to the east a fierce people arose: the Huns. They believe in a prophecy about a great king who will unite the tribes and challenge Rome for control of the world.","Pauline Lynch, Steven Berkoff, Andrew Pleavin, Tommy Flanagan",https://m.media-amazon.com/images/S/sash/4FyxwxECzL-U1J8.png
The Best Sex Ever,"Adventure, Drama, Fantasy",30 min,6.2,256,(2002–2003),Certificate N/A,"A radio show host invites listeners to call in and relate their own personal story of ""the best sex you ever had"".","Angela Nicholas, Syren, Dru Berrymore, Jezebelle Bond",https://m.media-amazon.com/images/S/sash/4FyxwxECzL-U1J8.png
Ramayan,"Adventure, Drama, Family",30 min,9.0,"22,753",(1987–1988),Certificate N/A,"An adaptation of the ancient epic, in which the exiled Prince Rama and his brother Laxman set out to save Rama's wife, Sita, who has been kidnapped by the demon king of Lanka Ravana.","Arun Govil, Deepika Chikhalia, Sunil Lahri, Arvind Trivedi",https://m.media-amazon.com/images/S/sash/4FyxwxECzL-U1J8.png
The Crossing,"Adventure, Drama, Sci-Fi",42 min,7.1,"9,996",(2018),Certificate N/A,Refugees from a war-torn country 180 years in the future start showing up in the present to seek asylum in an American town.,"Steve Zahn, Natalie Martinez, Tommy Bastow, Rob Campbell",https://m.media-amazon.com/images/S/sash/4FyxwxECzL-U1J8.png
Green Eggs and Ham,"Animation, Adventure, Comedy",26 min,8.1,"2,990",(2019–2022),Certificate N/A,"An animated series based on the popular Dr. Seuss story ""Green Eggs and Ham.""","Michael Douglas, Adam Devine, Ilana Glazer, Keegan-Michael Key",https://m.media-amazon.com/images/S/sash/4FyxwxECzL-U1J8.png
Pinky and the Brain,"Animation, Adventure, Comedy",30 min,7.8,"31,927",(1995–1998),Certificate N/A,A genius mouse and his stupid sidekick try to conquer the world each night.,"Maurice LaMarche, Rob Paulsen, Tress MacNeille, Frank Welker",https://m.media-amazon.com/images/S/sash/4FyxwxECzL-U1J8.png
The New Scooby-Doo Movies,"Animation, Adventure, Comedy",83 min,7.6,"5,326",(1972–1973),Certificate N/A,The Mystery Inc. gang investigate more supernatural sightings with various guest stars and characters.,"Nicole Jaffe, Casey Kasem, Don Messick, Heather North",https://m.media-amazon.com/images/S/sash/4FyxwxECzL-U1J8.png
Conan,"Action, Adventure, Fantasy",43 min,5.0,"1,489",(1997–1998),Certificate N/A,TV series featuring the mythical barbarian.,"Ralf Moeller, Danny Woodburn, Robert McRay, Jeremy Kemp",https://m.media-amazon.com/images/S/sash/4FyxwxECzL-U1J8.png
My Little Pony: Make Your Mark,"Animation, Adventure, Comedy",44 min,5.9,483,(2022– ),Certificate N/A,The series will center on the adventures of Sunny Starscout and her friends after the events depicted in the film.,"Bettina Kenney, Jenna Warren, Maitreyi Ramakrishnan, JJ Gerber",https://m.media-amazon.com/images/S/sash/4FyxwxECzL-U1J8.png
Sea Hunt,"Action, Adventure",30 min,7.7,"1,356",(1958–1961),Certificate N/A,"Mike Nelson is a S.C.U.B.A. diver in the days when it was still very new. He works alone, and the plot was mostly carried through his voice-over narrations. These gave the show a flavor of ...                See full summary »","Lloyd Bridges, Ken Drake, Courtney Brown, Jan Harrison",https://m.media-amazon.com/images/S/sash/4FyxwxECzL-U1J8.png
Neverwhere,"Adventure, Comedy, Drama",180 min,7.2,"2,971",(1996),Certificate N/A,"Richard Mayhew leads an ordinary life in London when one day a girl named Door falls, injured, across his path. The next thing he knows, his life is gone and he's pulled into the ...                See full summary »","Gary Bakewell, Laura Fraser, Hywel Bennett, Clive Russell",https://m.media-amazon.com/images/S/sash/4FyxwxECzL-U1J8.png
Power Rangers Dino Charge,"Action, Adventure, Family",21 min,6.4,"1,573",(2015–2016),Certificate N/A,"In prehistoric times, an alien entrusted 10 powerful Energemas to 10 dinosaurs, and these were lost with their extinction. Now an intergalactic bounty hunter seeks to reclaim the Energemas and destroy the Earth.","Brennan Mejia, Camille Hyde, Yoshi Sudarso, Michael Taber",https://m.media-amazon.com/images/S/sash/4FyxwxECzL-U1J8.png
Jake and the Never Land Pirates,"Animation, Adventure, Family",15 min,5.6,"1,990",(2011–2016),Certificate N/A,Add a Plot,"David Arquette, Corey Burton, Jeff Bennett, Loren Hoskins",https://m.media-amazon.com/images/S/sash/4FyxwxECzL-U1J8.png
Smurfs,"Animation, Adventure, Comedy",30 min,7.2,"20,145",(1981–1989),Certificate N/A,"The Smurfs are tiny blue creatures that live in mushroom houses in a peaceful forest. They repeatedly try to outwit Gargamel, an evil sorcerer, his apprentice, Scruple, and his mangy cat, Azrael.","Céline Montsarrat, Don Messick, Danny Goldman, Lucille Bliss",https://m.media-amazon.com/images/S/sash/4FyxwxECzL-U1J8.png
G.I. Joe,"Animation, Action, Adventure",30 min,7.7,"5,456",(1985–1986),Certificate N/A,An elite special missions force fights against the terrorist forces of Cobra.,"Jackson Beck, Christopher Collins, Michael Bell, Neil Ross",https://m.media-amazon.com/images/S/sash/4FyxwxECzL-U1J8.png
Grizzy and the Lemmings,"Animation, Adventure, Comedy",7 min,7.1,796,(2016–2023),Certificate N/A,"Grizzy and the Lemmings are in a violent, protracted conflict over the possession and ownership of ""Yummy"" a chocolate-hazelnut spread that looks like Nutella. Many foibles ensue.","Pierre-Alain de Garrigues, Josselin Charier, Pierre Coffin, Ben Bocquelet",https://m.media-amazon.com/images/S/sash/4FyxwxECzL-U1J8.png
Noble House,"Action, Adventure, Drama",355 min,7.6,"1,571",(1988),Certificate N/A,"Ian Struan Dunross is chairman of Struan & Company, the oldest and largest of the British-East Asia trading companies. To the Chinese, that also makes him ""Tai-Pan"" (""supreme leader"") of ...                See full summary »","Pierce Brosnan, Deborah Raffin, Ben Masters, John Rhys-Davies",https://m.media-amazon.com/images/S/sash/4FyxwxECzL-U1J8.png
Owari No Seraph,"Animation, Action, Adventure",24 min,7.4,"6,254",(2015),Certificate N/A,"In 2012, the world allegedly comes to an end at the hands of a human-made virus, ravaging the global populace and leaving only children untouched. It is at this time that vampires emerge from the recesses of the earth.","Miyu Irino, Micah Solusod, Saori Hayami, Nobuhiko Okamoto",https://m.media-amazon.com/images/S/sash/4FyxwxECzL-U1J8.png
Bravest Warriors,"Animation, Action, Adventure",5 min,8.1,"3,626",(2009–2018),Certificate N/A,Four teenage heroes-for-hire warp through the universe to save adorable aliens and their worlds using the power of their emotions.,"Liliana Mumy, John Omohundro, Ian Jones-Quartey, Graeme Jokic",https://m.media-amazon.com/images/S/sash/4FyxwxECzL-U1J8.png
Sonic Boom,"Animation, Short, Action",11 min,6.8,"6,785",(2014–2017),Certificate N/A,"23 years after the original Sonic the Hedgehog video game, fast, handsome, and arrogant hero Sonic continues to fight his arch nemesis, Dr. Eggman. Along with Tails, Knuckles, Amy, and a new recruit named Sticks.","Roger Craig Smith, Cindy Robinson, Colleen O'Shaughnessey, Travis Willingham",https://m.media-amazon.com/images/S/sash/4FyxwxECzL-U1J8.png
Kureimoa,"Animation, Action, Adventure",24 min,8.0,"14,620",(2007),Certificate N/A,"In a world rife with deadly creatures called ""youma"", a young silver eyed woman, Clare, works on behalf of an organization that trains female youma halfbreeds into warriors with the ability...                See full summary »","Todd Haberkorn, Stephanie Young, Houko Kuwashima, Cherami Leigh",https://m.media-amazon.com/images/S/sash/4FyxwxECzL-U1J8.png
Aladdin,"Animation, Action, Adventure",30 min,7.3,"12,476",(1994–1995),Certificate N/A,"Aladdin, the clever hero of Agrabah, continues his adventures with the help of his fiancee Princess Jasmine, his pet monkey Abu, Magic Carpet, Iago the greedy parrot, and of course his best friend the semi-cosmic Genie.","Scott Weinger, Linda Larkin, Dan Castellaneta, Frank Welker",https://m.media-amazon.com/images/S/sash/4FyxwxECzL-U1J8.png
Sonic X,"Animation, Action, Adventure",30 min,6.2,"5,240",(2003–2006),Certificate N/A,"A slight malfunction causes Chaos Control, and sends Sonic the Hedgehog to Earth. While there, Sonic meets Chris Thorndyke, who aids at collecting the Chaos Emeralds, so Sonic and friends can go home.","Gabriella Lewis, Jun'ichi Kanemaru, Sanae Kobayashi, Jason Griffith",https://m.media-amazon.com/images/S/sash/4FyxwxECzL-U1J8.png
Black Dynamite,"Animation, Action, Adventure",22 min,8.1,"4,775",(2011–2015),Certificate N/A,"Action comedy-spoof that follows ex-C. I. A. Agent and full-time ladies man, Black Dynamite, who's out to avenge the death of his brother against kung-fu masters, drug-dealing pimps, and The Man.","Michael Jai White, Byron Minns, Kym Whitley, Tommy Davidson",https://m.media-amazon.com/images/S/sash/4FyxwxECzL-U1J8.png
Destination Fear,"Adventure, History, Horror",42 min,7.1,"1,697",(2019–2023),Certificate N/A,"Maverick paranormal explorer Dakota Laden takes his sister, Chelsea, and best friend, Tanner, across the country in an RV to spend the night in the most haunted locations in America, testing the limits of human fear.","Dakota Laden, Chelsea Laden, Tanner Wiseman, Alex Schroeder",https://m.media-amazon.com/images/S/sash/4FyxwxECzL-U1J8.png
Tomb Raider,"Animation, Action, Adventure",Run Time N/A,Rating N/A,Votes N/A,(2023– ),Certificate N/A,Follows heroine Lara Croft as she explores new territory.,"Hayley Atwell, Allen Maldonado, Earl Baylon",https://m.media-amazon.com/images/S/sash/4FyxwxECzL-U1J8.png
Wedding Season,"Action, Adventure, Comedy",Run Time N/A,6.5,"1,751",(2022– ),Certificate N/A,"We meet Katie on her wedding day, surrounded by the dead bodies of her new husband and every member of his family. The police think Katie's lover Stefan did it. Stefan thinks Katie did it. ...                See full summary »","Gavin Drea, Rosa Salazar, Jade Harrison, Jamie Michie",https://m.media-amazon.com/images/S/sash/4FyxwxECzL-U1J8.png
